{
  "schema_version": 2,
  "artifact_type": "episode_candidates",
  "summary": {"frame_count": 1, "candidate_count": 1},
  "units": {"bbox": "pixels"},
  "episode_dir": "/fixtures/episode0",
  "instruction": "pick up the red block",
  "role_spec": {
    "target": "red block",
    "reference": null,
    "interaction_part": null
  },
  "semantic_groups": [
    {
      "semantic_group_id": "SG1",
      "name": "red block",
      "prompts": ["red block"],
      "identity_cues": ["red"],
      "negative_cues": [],
      "compatible_roles": ["target"],
      "role_discriminative": true
    }
  ],
  "camera_names": ["front"],
  "frames": [
    {
      "frame_id": "0",
      "frame_index": 0,
      "camera_names": ["front"],
      "candidate_count": 1
    }
  ]
}
